{
  "$schema": "./catalog.schema.json",
  "portfolio": "aws-compliance-security-labs",
  "version": "2.0.0",
  "description": "Combined monorepo of modular AWS labs for NIST 800-171/800-53, ISO 27001, PCI DSS, and FedRAMP 20x (CR26) KSI automation",
  "scf_api": "https://grcengclub.github.io/scf-api/",
  "architecture_pattern": "Data sources \u2192 GuardDuty/Config/Inspector \u2192 Security Hub \u2192 EventBridge \u2192 Lambda \u2192 Evidence & Alerts",
  "source_repos_owner": "kfcain",
  "labs": [
    {
      "id": "01-mfa-continuous-validation",
      "title": "Persistent MFA Validation (Okta / Descope)",
      "repo_name": "lab-mfa-continuous-validation",
      "path": "labs/01-mfa-continuous-validation",
      "summary": "Continuously validate phishing-resistant MFA enrollment and use for human identities via Okta or Descope, correlated with AWS IAM Identity Center and CloudTrail.",
      "primary_risk": "Account takeover from missing or bypassed MFA",
      "scf_controls": [
        "IAC-06",
        "IAC-15",
        "IAC-21",
        "MON-01"
      ],
      "ksi": [
        "KSI-IAM-APM",
        "KSI-IAM-ELP",
        "KSI-MLA-RVL"
      ],
      "frameworks": [
        "general-nist-800-53-r5-2",
        "general-nist-800-171-r3",
        "general-iso-27001-2022",
        "general-pci-dss-4-0-1",
        "usa-federal-gsa-fedramp-5-mod",
        "general-nist-800-171-r2",
        "usa-federal-dow-cmmc-2-level-2"
      ],
      "aws_services": [
        "IAM Identity Center",
        "CloudTrail",
        "EventBridge",
        "Lambda",
        "Security Hub",
        "SNS",
        "DynamoDB"
      ],
      "external_services": [
        "Okta",
        "Descope"
      ],
      "source_repo": "https://github.com/kfcain/lab-mfa-continuous-validation",
      "pages": "https://kfcain.github.io/lab-mfa-continuous-validation/",
      "status": "hardened"
    },
    {
      "id": "02-inspector-vdr",
      "title": "Vulnerability Detection & Response (Inspector VDR)",
      "repo_name": "lab-inspector-vdr",
      "path": "labs/02-inspector-vdr",
      "summary": "Automate FedRAMP CR26 VDR-CSO-DET and VDR-TFR-PVR: continuous scanning with Amazon Inspector, N1\u2013N5 severity SLAs, Security Hub aggregation, and remediation evidence.",
      "primary_risk": "Unpatched CVEs leading to breach and failed authorization",
      "scf_controls": [
        "VPM-01",
        "VPM-02",
        "MON-01",
        "THR-01"
      ],
      "ksi": [
        "KSI-MLA-EVC",
        "VDR-CSO-DET",
        "VDR-TFR-PVR"
      ],
      "frameworks": [
        "general-nist-800-53-r5-2",
        "general-nist-800-171-r3",
        "general-iso-27001-2022",
        "general-pci-dss-4-0-1",
        "usa-federal-gsa-fedramp-5-mod",
        "general-nist-800-171-r2",
        "usa-federal-dow-cmmc-2-level-2"
      ],
      "aws_services": [
        "Inspector",
        "Security Hub",
        "EventBridge",
        "Lambda",
        "Systems Manager",
        "S3",
        "SNS"
      ],
      "external_services": [],
      "source_repo": "https://github.com/kfcain/lab-inspector-vdr",
      "pages": "https://kfcain.github.io/lab-inspector-vdr/",
      "status": "hardened"
    },
    {
      "id": "03-nhi-credential-rotation",
      "title": "Non-Human Identity Credential & Token Rotation",
      "repo_name": "lab-nhi-credential-rotation",
      "path": "labs/03-nhi-credential-rotation",
      "summary": "Discover, inventory, and rotate service accounts, IAM access keys, API tokens, and workload identities on a policy cadence with break-glass evidence.",
      "primary_risk": "Long-lived machine credentials enabling lateral movement",
      "scf_controls": [
        "IAC-15",
        "IAC-21",
        "CRY-01",
        "CFG-02"
      ],
      "ksi": [
        "KSI-IAM-ELP",
        "KSI-IAM-JIT",
        "KSI-SVC-ASM"
      ],
      "frameworks": [
        "general-nist-800-53-r5-2",
        "general-nist-800-171-r3",
        "general-iso-27001-2022",
        "general-pci-dss-4-0-1",
        "usa-federal-gsa-fedramp-5-mod",
        "general-nist-800-171-r2",
        "usa-federal-dow-cmmc-2-level-2"
      ],
      "aws_services": [
        "IAM",
        "Secrets Manager",
        "KMS",
        "EventBridge",
        "Lambda",
        "CloudTrail",
        "DynamoDB",
        "SNS"
      ],
      "external_services": [
        "Okta Machine Auth",
        "Descope M2M"
      ],
      "source_repo": "https://github.com/kfcain/lab-nhi-credential-rotation",
      "pages": "https://kfcain.github.io/lab-nhi-credential-rotation/",
      "status": "hardened"
    },
    {
      "id": "04-config-drift-compliance",
      "title": "Continuous Config Drift & Control Status",
      "repo_name": "lab-config-drift-compliance",
      "path": "labs/04-config-drift-compliance",
      "summary": "Use AWS Config + Security Hub to persistently evaluate resource posture against SCF-mapped rules and emit pass/fail evidence for auditors.",
      "primary_risk": "Silent configuration drift breaking baseline controls",
      "scf_controls": [
        "CFG-01",
        "CFG-02",
        "CPL-01",
        "CPL-02",
        "MON-01"
      ],
      "ksi": [
        "KSI-CNA-EIS",
        "KSI-MLA-EVC",
        "KSI-SVC-ACM"
      ],
      "frameworks": [
        "general-nist-800-53-r5-2",
        "general-nist-800-171-r3",
        "general-iso-27001-2022",
        "general-pci-dss-4-0-1",
        "usa-federal-gsa-fedramp-5-mod",
        "general-nist-800-171-r2",
        "usa-federal-dow-cmmc-2-level-2"
      ],
      "aws_services": [
        "Config",
        "Security Hub",
        "EventBridge",
        "Lambda",
        "S3",
        "SNS",
        "Organizations"
      ],
      "external_services": [],
      "source_repo": "https://github.com/kfcain/lab-config-drift-compliance",
      "pages": "https://kfcain.github.io/lab-config-drift-compliance/",
      "status": "hardened"
    },
    {
      "id": "05-guardduty-automated-response",
      "title": "GuardDuty Threat Detection & Automated Response",
      "repo_name": "lab-guardduty-automated-response",
      "path": "labs/05-guardduty-automated-response",
      "summary": "Ingest VPC Flow Logs and CloudTrail into GuardDuty, centralize in Security Hub, and auto-contain via EventBridge \u2192 Lambda playbooks.",
      "primary_risk": "Delayed response to active compromise increases blast radius",
      "scf_controls": [
        "THR-01",
        "THR-03",
        "MON-01",
        "MON-02",
        "IRO-02"
      ],
      "ksi": [
        "KSI-CNA-MAT",
        "KSI-INR-RIR",
        "KSI-MLA-OSM"
      ],
      "frameworks": [
        "general-nist-800-53-r5-2",
        "general-nist-800-171-r3",
        "general-iso-27001-2022",
        "general-pci-dss-4-0-1",
        "usa-federal-gsa-fedramp-5-mod",
        "general-nist-800-171-r2",
        "usa-federal-dow-cmmc-2-level-2"
      ],
      "aws_services": [
        "VPC Flow Logs",
        "CloudTrail",
        "GuardDuty",
        "Security Hub",
        "EventBridge",
        "Lambda",
        "SNS",
        "Step Functions"
      ],
      "external_services": [],
      "source_repo": "https://github.com/kfcain/lab-guardduty-automated-response",
      "pages": "https://kfcain.github.io/lab-guardduty-automated-response/",
      "status": "hardened"
    },
    {
      "id": "06-kms-encryption-governance",
      "title": "KMS Encryption & Secrets Governance",
      "repo_name": "lab-kms-encryption-governance",
      "path": "labs/06-kms-encryption-governance",
      "summary": "Enforce encryption at rest/in transit with customer-managed KMS keys, FIPS endpoints, key rotation, and Secrets Manager policy gates.",
      "primary_risk": "Unencrypted data exposure and cryptographic non-conformance",
      "scf_controls": [
        "CRY-01",
        "CRY-03",
        "CFG-02",
        "CLD-01"
      ],
      "ksi": [
        "KSI-SVC-ASM",
        "KSI-SVC-SIN"
      ],
      "frameworks": [
        "general-nist-800-53-r5-2",
        "general-nist-800-171-r3",
        "general-iso-27001-2022",
        "general-pci-dss-4-0-1",
        "usa-federal-gsa-fedramp-5-mod",
        "general-nist-800-171-r2",
        "usa-federal-dow-cmmc-2-level-2"
      ],
      "aws_services": [
        "KMS",
        "Secrets Manager",
        "Config",
        "CloudTrail",
        "Lambda",
        "S3",
        "ACM"
      ],
      "external_services": [],
      "source_repo": "https://github.com/kfcain/lab-kms-encryption-governance",
      "pages": "https://kfcain.github.io/lab-kms-encryption-governance/",
      "status": "hardened"
    },
    {
      "id": "07-cloudtrail-evidence-pipeline",
      "title": "Immutable Audit Evidence Pipeline",
      "repo_name": "lab-cloudtrail-evidence-pipeline",
      "path": "labs/07-cloudtrail-evidence-pipeline",
      "summary": "Build an org-wide CloudTrail \u2192 S3 (Object Lock) \u2192 Athena/Security Lake pipeline that packages machine-readable evidence for FedRAMP 20x persistent validation.",
      "primary_risk": "Inability to prove who did what \u2014 audit failure and legal exposure",
      "scf_controls": [
        "MON-01",
        "MON-02",
        "CPL-02",
        "CHG-01"
      ],
      "ksi": [
        "KSI-CMT-LMC",
        "KSI-MLA-OSM",
        "KSI-MLA-RVL"
      ],
      "frameworks": [
        "general-nist-800-53-r5-2",
        "general-nist-800-171-r3",
        "general-iso-27001-2022",
        "general-pci-dss-4-0-1",
        "usa-federal-gsa-fedramp-5-mod",
        "general-nist-800-171-r2",
        "usa-federal-dow-cmmc-2-level-2"
      ],
      "aws_services": [
        "CloudTrail",
        "S3 Object Lock",
        "EventBridge",
        "Lambda",
        "Athena",
        "Security Lake",
        "Glue"
      ],
      "external_services": [],
      "source_repo": "https://github.com/kfcain/lab-cloudtrail-evidence-pipeline",
      "pages": "https://kfcain.github.io/lab-cloudtrail-evidence-pipeline/",